{
  "bundle_version": "DIARY_ONE_EXPERIMENT_BUNDLE_V01",
  "research_only": true,
  "session": {
    "session_id": "APP_EXPORT_EXAMPLE_001",
    "exported_at": "2026-08-18T12:00:00+08:00",
    "timezone": "Asia/Shanghai"
  },
  "device": {
    "device_id": "pseudonymous-device-example",
    "hardware_revision": "EXAMPLE",
    "firmware_version": "EXAMPLE",
    "sdk_version": "EXAMPLE"
  },
  "media_profile": {
    "profile_id": "EXAMPLE_PORTRAIT_3X4_V01",
    "width": 120,
    "height": 160,
    "orientation": "PORTRAIT",
    "aspect_ratio": "3:4"
  },
  "source": {
    "kind": "FIXTURE",
    "relative_path": "media/source_fixture.json",
    "sha256": "94471f6b3124253b419c997285f64635da91cd7693ed077222fef1c06dc93c0c",
    "duration_ms": 489000
  },
  "processing": {
    "capture_interval_ms": 120000,
    "logical_asset_duration_ms": 9000,
    "frame_offsets_ms": [1500, 4500, 7500],
    "materialize_logical_assets": false
  }
}
